keyword	patent	title	sentence	section
advertisement				
	WO2014005022A1	Individualizing generic communications	[0055] In embodiments of the present invention, the communication is an ADVERTISEMENT or a public service communication.	[0055] In embodiments of the present invention, the communication is an advertisement or a public service communication. In a further embodiment, the communicator receives a reply from the individual in response to the communication. 
	US9189886	Method and apparatus for estimating body shape	 Such attributes might be items for sale, information about preferred clothing sizes, images, textual information or ADVERTISEMENTs.	Finally, a means for body shape matching takes a body produced from some measurements (tailoring measures, images, range sensor data) and returns one or more “scores” indicating how similar it is in shape to another body or database of bodies. This matching means is used to rank body shape similarity to, for example, reorder a display of attributes associated with a database of bodies. Such attributes might be items for sale, information about preferred clothing sizes, images, textual information or advertisements. The display of these attributes presented to a user may be ordered so that the presented items are those corresponding to people with bodies most similar to theirs. The matching and ranking means can be used to make selective recommendations based on similar body shapes. The attributes (e.g. clothing size preference) of people with similar body shapes can be aggregated to recommend attributes to a user in a form of body-shape-sensitive collaborative filtering.
	US10534808	Architecture for responding to visual query	 Similarly, if a scan of a magazine was used as the visual query, the interactive results document may include visual identifiers for photographs or trademarks in ADVERTISEMENTs on the page as well as a visual identifier for the text of an article also on that page.	In some embodiments, the interactive results document produced in response to a visual query can include a plurality of links that correspond to results from the same search system. For example, a visual query may be an image or picture of a group of people. The interactive results document may include bounding boxes around each person, which when activated returns results from the facial recognition search system for each face in the group. For some visual queries, a plurality of links in the interactive results document corresponds to search results from more than one search system (310). For example, if a picture of a person and a dog was submitted as the visual query, bounding boxes in the interactive results document may outline the person and the dog separately. When the person (in the interactive results document) is selected, search results from the facial recognition search system are returned, and when the dog (in the interactive results document) is selected, results from the image-to-terms search system are returned. For some visual queries, the interactive results document contains an OCR result and an image match result (312). For example, if a picture of a person standing next to a sign were submitted as a visual query, the interactive results document may include visual identifiers for the person and for the text in the sign. Similarly, if a scan of a magazine was used as the visual query, the interactive results document may include visual identifiers for photographs or trademarks in advertisements on the page as well as a visual identifier for the text of an article also on that page.
	US9467750	Placing unobtrusive overlays in video content	Given the broad distribution of such video content and growing proliferation of viewing and playback devices for viewing such video content, providers and distributors of video content often employ video-advertising techniques to insert ADVERTISEMENTs into video content.	Given the broad distribution of such video content and growing proliferation of viewing and playback devices for viewing such video content, providers and distributors of video content often employ video-advertising techniques to insert advertisements into video content.
	US8189957	View projection for dynamic configurations	 For example, the moving object could be an ADVERTISEMENT display, and the transformed image pI could provide additional information related to the ADVERTISEMENT display.	This method would be particularly useful for advisement purposes. For example, the moving object could be an advertisement display, and the transformed image pI could provide additional information related to the advertisement display.
airport				
	US9363489	Video analytics configuration	 The network may simply comprise a single video camera monitoring a portal which, for example, may be a door, a corridor, a lift, an entrance hall, an exit hall, a concourse, an AIRPORT security gate or anywhere there may be numerous individuals passing through.	Video surveillance networks comprise one or more video cameras arranged to provide surveillance of a particular geographical location. The network may simply comprise a single video camera monitoring a portal which, for example, may be a door, a corridor, a lift, an entrance hall, an exit hall, a concourse, an airport security gate or anywhere there may be numerous individuals passing through. In some cases, such as an entrance hall for a large shopping center or a departures hall of an airport, there may be thousands of people passing through in a relatively short space of time. This makes tracking individuals who may be considered to be a threat or of interest to security in such cases fraught with difficulty.
	US9483689	Biometric matching technology	 The system 300 also determines whether the context of the situation is in a crime-sensitive area or jewelry store, whether the context of the situation is in an AIRPORT or railway station, whether the context of the situation is in a public transport location, a public park, or vehicular surveillance, or whether the context of the situation is in home security or school campus security.	The system 300 references the data structure 1500 in setting the batch size. For example, the system 300 determines the context and criticality of the situation based on user input, a pre-defined setting, and/or an alert feed (e.g., a threat level alert provided by a government organization or other organization). In this example, the system 300 determines whether the criticality of the situation is very high, high, medium, or low. The system 300 also determines whether the context of the situation is in a crime-sensitive area or jewelry store, whether the context of the situation is in an airport or railway station, whether the context of the situation is in a public transport location, a public park, or vehicular surveillance, or whether the context of the situation is in home security or school campus security. Based on the determinations, the system 300 references the data structure 1500 and sets the batch size as the number of images defined by the data structure 1500. For instance, the system 300 selects fifty images based on determining that the criticality is very high and the context is in a crime-sensitive area or jewelry store, selects twenty images based on determining that the criticality is high and the context is in an airport or railway station, selects ten images based on determining that the criticality is medium and the context is in a public transport location, a public park, or vehicular surveillance, and selects five images based on determining that the criticality is low and the context is in home security or school campus security.
	US9076030	Liveness detection	While not illustrated in FIG. 4, in parallel with or after verifying that the face in the image sequence is a living face, the face is for example compared to the image of the identity document, and if there is a match, the user 102 is for example permitted to access a restricted area, for example an AIRPORT departure lounge.	While not illustrated in FIG. 4, in parallel with or after verifying that the face in the image sequence is a living face, the face is for example compared to the image of the identity document, and if there is a match, the user 102 is for example permitted to access a restricted area, for example an airport departure lounge. For example, the document checkpoint 100 of FIG. 1 may comprising an automatic barrier, that is opened only if a living face of the user 102 is found to match the registered image of the identity document.
	US10677932	Systems, methods, and devices for geo-localization	 Accordingly, small wearable devices can be used for navigating AIRPORT buildings, hospitals, malls, campus buildings, homes, or the like.	The embodiments described herein can provide seamless continuous navigation between indoor and outdoor environment. Specifically, GIS and BIM can be abstracted to map graphs that are used for navigation. The map graphs can be memory efficient. Thus, small low cost solutions can be provided by using low resolution sensors and map graphs on memory that are scaled to the size of the location being navigated. Additionally, the small solutions can be provided without requiring communication signals, i.e., internet or GPS, which can decrease power demands. Accordingly, small wearable devices can be used for navigating airport buildings, hospitals, malls, campus buildings, homes, or the like.
	WO2018193123A1	Detection system, detection device and method therefor	 More particularly, the invention relates to a system for detecting a passenger which may be used by a security agent, an airline agent, or other agent at an AIRPORT or other transportation hub such as a railway station, or bus station.	FIELD OF THE INVENTION This invention relates in general to an image processing system. More particularly, this invention relates to a system, apparatus, method or computer program for detecting an individual such as a customer or passenger, or a device for use by an agent. More particularly, the invention relates to a system for detecting a passenger which may be used by a security agent, an airline agent, or other agent at an airport or other transportation hub such as a railway station, or bus station. 
apartment				
	CN103269751B	Light therapy apparatus		
	US10867496	Methods and systems for presenting video feeds	 The present teachings are also applicable, without limitation, to duplexes, townhomes, multi-unit APARTMENT buildings, hotels, retail stores, office buildings, industrial buildings, and more generally any living space or work space.	It is to be appreciated that “smart home environments” may refer to smart environments for homes such as a single-family house, but the scope of the present teachings is not so limited. The present teachings are also applicable, without limitation, to duplexes, townhomes, multi-unit apartment buildings, hotels, retail stores, office buildings, industrial buildings, and more generally any living space or work space.
	US9672427	Systems and methods for categorizing motion events	 The present teachings are also applicable, without limitation, to duplexes, townhomes, multi-unit APARTMENT buildings, hotels, retail stores, office buildings, industrial buildings, and more generally to any living space or work space.	It is to be appreciated that “smart home environments” may refer to smart environments for homes such as a single-family house, but the scope of the present teachings is not so limited. The present teachings are also applicable, without limitation, to duplexes, townhomes, multi-unit apartment buildings, hotels, retail stores, office buildings, industrial buildings, and more generally to any living space or work space.
	US9544636	Method and system for editing event categories	 The present teachings are also applicable, without limitation, to duplexes, townhomes, multi-unit APARTMENT buildings, hotels, retail stores, office buildings, industrial buildings, and more generally any living space or work space.	It is to be appreciated that “smart home environments” may refer to smart environments for homes such as a single-family house, but the scope of the present teachings is not so limited. The present teachings are also applicable, without limitation, to duplexes, townhomes, multi-unit apartment buildings, hotels, retail stores, office buildings, industrial buildings, and more generally any living space or work space.
	US9224044	Method and system for video zone monitoring	 The present teachings are also applicable, without limitation, to duplexes, townhomes, multi-unit APARTMENT buildings, hotels, retail stores, office buildings, industrial buildings, and more generally any living space or work space.	It is to be appreciated that “smart home environments” may refer to smart environments for homes such as a single-family house, but the scope of the present teachings is not so limited. The present teachings are also applicable, without limitation, to duplexes, townhomes, multi-unit apartment buildings, hotels, retail stores, office buildings, industrial buildings, and more generally any living space or work space.
army				
	US10293485	Systems and methods for robotic path planning	 By way of illustration, the first control characteristic can correspond to a first wheel angle, first ARMY position, and/or any other control characteristic described in this disclosure.	In some cases, the actuator commands can take the form of adjusting actuators in accordance to control characteristics identified for robot 200 to travel along the first path portion. For example, robot 200 can generate an actuator command to effectuate the first control characteristic of a string of control characteristics of the first path portion (e.g., taking the control characteristic corresponding to the first arrow of trajectory 726, and/or any other trajectory, path, and/or path portion). In some cases, this first control characteristic can be the only control characteristic effectuated, wherein robot 200 then reassesses the path (e.g., finds another first path portion in accordance to method 400) after sending the actuator command comprising the first control characteristic. Advantageously, this can allow robot 200 to reassess the path after each move, giving greater potential for optimal path planning. In some cases, the first control characteristic can be a model predictive control. By way of illustration, the first control characteristic can correspond to a first wheel angle, first army position, and/or any other control characteristic described in this disclosure.
	US9888105	Intuitive computing methods and systems	 Forward the pixels to the “cloud” and have a vast ARMY of anonymous computers apply every known image recognition algorithm to the data until one finally identifies the depicted subject.	Hypothetically, the problem has a straightforward solution. Forward the pixels to the “cloud” and have a vast army of anonymous computers apply every known image recognition algorithm to the data until one finally identifies the depicted subject. (One particular approach would be to compare the unknown image with each of the billions of images posted to web-based public photo repositories, such as Flickr and Facebook. After finding the most similar posted photo, the descriptive words, or “metadata,” associated with the matching picture could be noted, and used as descriptors to identify the subject of the unknown image.) After consuming a few days or months of cloud computing power (and megawatts of electrical power), an answer would be produced.
	CN103763515A	Video anomaly detection method based on machine learning	Along with the development of Chinese society and the rise of electronic applications, video monitoring system has been widely used in all trades and professions very much, no longer be confined to the special dimensions such as public security, finance, bank, traffic, ARMY and port in the past, our daily life tentacle energy and community, office building, hotel, public place, factory, market, community, even family, has all installed video monitoring system.	Along with the development of Chinese society and the rise of electronic applications, video monitoring system has been widely used in all trades and professions very much, no longer be confined to the special dimensions such as public security, finance, bank, traffic, army and port in the past, our daily life tentacle energy and community, office building, hotel, public place, factory, market, community, even family, has all installed video monitoring system.But along with the continuous increase of application scenario CCTV camera quantity, the time of monitoring constantly extends, artificial more and more difficult to the maintenance of monitoring software in real time, so also more and more urgent for the intellectuality of monitoring software.
	US9202184	Optimizing the selection, verification, and deployment of expert resources in a time of chaos	 A cohort or unified group may be considered an entity rather than a group of individual skills, such as a fully functioning mobile ARMY surgical hospital (MASH) unit.	The needed skills are optimized based on requirements and constraints for expert services, a potential skills pool, cohorts of a related set of skills, and enabling resources. Optimization is the process of finding a solution that is the best fit based on the available resources and specified constraints. The solution is skills and resources that are available and is recognized as the best solution among numerous alternatives because of the constraints, requirements, and other circumstances and criteria of the chaotic event. A cohort or unified group may be considered an entity rather than a group of individual skills, such as a fully functioning mobile army surgical hospital (MASH) unit.
	CN102945374A	Method for automatically detecting civil aircraft in high-resolution remote sensing image	In recent years, along with the development of remote sensing technology and improving constantly of image resolution ratio, automatically detection not only has important application value in ARMY with the identification all types of target from high-resolution remote sensing image, also more and more becomes the focus that civil aviaton remote sensing field is paid close attention to.	All the time, to the detection of interesting target in the image and identification all be one important subject.In recent years, along with the development of remote sensing technology and improving constantly of image resolution ratio, automatically detection not only has important application value in army with the identification all types of target from high-resolution remote sensing image, also more and more becomes the focus that civil aviaton remote sensing field is paid close attention to.Wherein the aircarrier aircraft in the high-resolution remote sensing image detects automatically, as the important component part of target detection, because its important guiding effect at aspects such as city planning, airdrome controls, in also studying always and exploring.But generally, because the impact of the factors such as the size of the complicacy of high-resolution remote sensing image and airframe, contrast is wanted to guarantee higher verification and measurement ratio and be not easy under the less prerequisite of false-alarm.
baggage				
	US10148918	Modular shelving systems for package tracking	 Although shown in FIG. 2 as trucks, a delivery vehicle 202 may be any form of transport, including, but not limited to, an airplane, automobile, van, sea-going vessel, train, airplane BAGGAGE cart.	 FIG. 2 shows an example of an implementation of the package tracking system 100 (FIG. 1) within a delivery system 200. For illustration purposes, the delivery system 200 includes multiple delivery vehicles 202-1, 202-n (generally, 202) and scanners 124-1, 124-n (generally, 124) used by personnel to obtain package identification information from packages. Although shown in FIG. 2 as trucks, a delivery vehicle 202 may be any form of transport, including, but not limited to, an airplane, automobile, van, sea-going vessel, train, airplane baggage cart. The delivery vehicles 202 and scanners 124 are in communication with a central server (or servers) 204 over communication connections 206. The server 204 (or servers) can be cloud based, meaning that a provider of the server 204 makes applications, services, and resources available on demand to users over a network (e.g., the Internet). The communication connections 206 may be established using any type of communication system including, but not limited to, a cellular network, private network, local network, wired network, wireless network, or any combination thereof.
	US9875392	System and method for face capture and matching	, via another image capture device 102) as they exit the customs area, allowing for the calculation of the BAGGAGE retrieval and customs process time, and the total arrivals process time.	Referring to FIG. 7, a more detailed example 160 of passenger timing is illustrated. At Position 1 at an air bridge, as passengers step outside the aircraft and walk through the jetty, their face may be captured for the first time by the image capture device 102, and stored in the enrolled identities database 115. At Position 2, at the immigration hall entrance, passengers' faces may be captured (e.g., via another image capture device 102) as they enter the immigration hall, giving the dwell time for transit from gate to hall, and providing for the calculation of time to clear immigration. At Position 3, at automated border clearance (ACS) gates, the photos from the ACS gates may be used to monitor the immigration clearance time of passengers using the ACS gates compared to the overall passenger flow, without additional image capture hardware being needed. At Position 4, at the immigration hall exit, passengers' faces may be captured (e.g., via another image capture device 102) as they clear immigration, allowing for the calculation of the dwell time for the immigration process. At Position 5, at the arrivals hall, passengers' faces may be captured (e.g., via another image capture device 102) as they exit the customs area, allowing for the calculation of the baggage retrieval and customs process time, and the total arrivals process time.
	US9355308	Auditing video analytics through essence generation	 Human auditors generally make fewer mistakes than results obtained by auditing through filtering by machine intelligence, and thus human auditors may provide better efficiencies in applications where true events may occur infrequently, such as in retail fraud detection or abandoned BAGGAGE alerts, and still other examples will be apparent to one skilled in the art.	Visual essences are generally compact and/or condensed so that they require less bandwidth than video data for visualization in an auditing system; only frames or limited video selections need be transmitted to the auditor for review, not a much larger or entire video feed as is typically required in the prior art. Smaller visual essences (for example, discrete data files) may also be more readily downloaded to, and stored in local machines for faster system responses compared to larger video feeds. Further, as analysts need only watch summaries about an event, pruning operations are faster and their throughput rate may be higher. Human auditors generally make fewer mistakes than results obtained by auditing through filtering by machine intelligence, and thus human auditors may provide better efficiencies in applications where true events may occur infrequently, such as in retail fraud detection or abandoned baggage alerts, and still other examples will be apparent to one skilled in the art.
	WO2018193123A1	Detection system, detection device and method therefor		
	EP3113070A1	Method and system for optical user recognition		
caste				
	EP2263598B2	Method for fabricating a plurality of dental incremental position adjustment appliances		
	CN107292314A	A kind of lepidopterous insects species automatic identification method based on CNN		
	US6858826	Method and apparatus for scanning three-dimensional objects		
citizen				
