keyword	patent	title	sentence	section
	US9208543	Deblurring images having spatially varying blur	 The blur kernel sizing module 220 may include an autocorrelation-based size estimator 222 to estimate a first size of the blur kernel, a latent image-based size estimator 224 to estimate a second size of the blur kernel, and process the results to suggest or RECOMMEND a size of the blur kernel to be used to deblur the image.	As described herein, example systems and methods are described that may automatically estimate or otherwise determine the size of a blur kernel used to deblur at least one region of a blurred image. FIG. 2 is a block diagram of example components (or modules) of a blur kernel sizing engine 150, in accordance with an example embodiment. The example components may be hardware, software, or a combination of hardware and software, and may be executed by one or more processors. In the example embodiment, the blur kernel sizing engine 150 is shown to include an image module 210 and a blur kernel sizing module 220. The blur kernel sizing module 220 may include an autocorrelation-based size estimator 222 to estimate a first size of the blur kernel, a latent image-based size estimator 224 to estimate a second size of the blur kernel, and process the results to suggest or recommend a size of the blur kernel to be used to deblur the image. It is however to be noted that the autocorrelation-based size estimator 222 and the latent image-based size estimator 224 are merely examples of estimators, and that other mathematical techniques may be used in other embodiments.
	US9715902	Audio-based annotation of video	Furthermore, the computer system may provide a RECOMMENDation for another content item (or multiple other content items) that includes additional audio information and additional video information based on the determined annotation items.	Furthermore, the computer system may provide a recommendation for another content item (or multiple other content items) that includes additional audio information and additional video information based on the determined annotation items. Alternatively or additionally, the computer system may provide a rating of the content item based on the determined annotation items. This rating may indicate: an estimated popularity of the content item, quality of the audio information, quality of the video information, and/or quality of the content item. Note that the recommendation and/or the rating may be determined and/or provided separately for the content item and/or the audio information and the video information.
	CN104732491A	Edge priority guide single-frame remote sensing image super-resolution processing method		
	US9418482	Discovering visited travel destinations from a set of digital images	 Further, action suggestions can RECOMMEND a book or video that describes the depicted landmark that might be of interest to the user, or a link for the user to write an email to a friend from her social network that has traveled to the depicted landmark.	When a user views images that depict the travels of her connections within the social networking system, it is common for her to desire to travel to one or more of the landmarks she has viewed. Referring again to FIG. 6, action suggestions 609 can be placed in association with the geo-recognized image 333. These action suggestions can provide a suggested action for the user: to plan travel with one or more partner sites (e.g., the fictitious TravelHelper or SeeUSA travel sites). Further, action suggestions can recommend a book or video that describes the depicted landmark that might be of interest to the user, or a link for the user to write an email to a friend from her social network that has traveled to the depicted landmark. In certain embodiments, the action suggestion can be a link to one or more partner sites, including travel, tourism, or review/rating websites, and can be provided to the user for the purpose of aiding the user to travel to the destination or venue depicted in the image. The partner sites can provide payment for appearing as an action suggestion for the user.
reidentification				
	US9535563	Internet appliance system and method	 Thus, once an object is identified, an expected change in that object will not necessitate a REIDENTIFICATION of the object.	In a preferred embodiment, a model contained in a database includes a three or more dimensional representation of an object. These models include information processed by a fractal-based method to encode repetitive, transformed patterns in a plane, space, time, etc., as well as to include additional degrees of freedom, to compensate for changes in morphology of the object, to allow continuous object identification and tracking. Thus, once an object is identified, an expected change in that object will not necessitate a reidentification of the object. According to one embodiment, a fractal-like processing is executed by optical elements of an optical or optical hybrid computer. Further, in order to temporarily store an optical image, optically active biological molecules, such as bacteriorhodopsins, etc. may be used. Liquid crystals or other electrophotorefractive active materials may also used. These imagers may be simple two dimensional images, holograms, or other optical storage methods. A preferred holographic storage method is a volume phase hologram, which will transform an impressed image, based on hologram to image correlation. Thus, these models would be somewhat linear transform independent, and would likely show some (planar) transform relationship. Thus, an optical computer may be advantageous because of its high computational speed as compared to digital computers for image analysis, due to inherent parallelism and high inherent speed.
	USRE46310	Ergonomic man-machine interface incorporating adaptive pattern recognition based control system	 Thus, once an object is identified, an expected change in that object will not necessitate a REIDENTIFICATION of the object.	In a preferred embodiment, a model contained in a database includes a three or more dimensional representation of an object. These models include information processed by a fractal-based method to encode repetitive, transformed patterns in a plane, space, time, etc., as well as to include additional degrees of freedom, to compensate for changes in morphology of the object, to allow continuous object identification and tracking. Thus, once an object is identified, an expected change in that object will not necessitate a reidentification of the object. According to one embodiment, a fractal-like processing is executed by optical elements of an optical or optical hybrid computer. Further, in order to temporarily store an optical image, optically active biological molecules, such as bacteriorhodopsins, etc. may be used. Liquid crystals or other electrophotorefractive active materials may also used. These imagers may be simple two dimensional images, holograms, or other optical storage methods. A preferred holographic storage method is a volume phase hologram, which will transform an impressed image, based on hologram to image correlation. Thus, these models would be somewhat linear transform independent, and would likely show some (planar) transform relationship. Thus, an optical computer may be advantageous because of its high computational speed as compared to digital computers for image analysis, due to inherent parallelism and high inherent speed.
	US9607245	Adapted vocabularies for matching image signatures with fisher vectors	In accordance with another aspect of the exemplary embodiment, a method for generating a system for object REIDENTIFICATION includes providing a universal generative model generated using local descriptors extracted from images in a training set.	In accordance with another aspect of the exemplary embodiment, a method for generating a system for object reidentification includes providing a universal generative model generated using local descriptors extracted from images in a training set. The universal generative model is adapted to a first camera to obtain a first camera-dependent generative model using local descriptors extracted from images captured by the first camera. The universal generative model is adapted to a second camera to obtain a second camera-dependent generative model using local descriptors extracted from images captured by the first camera. A component is provided for computing at least one of an image-level representation of a first image using the first camera-dependent generative model, and an image-level representation of a first image using the first camera-dependent generative model. A component is provided for computing a similarity between the first image-level descriptor and the second image-level descriptor.
	US10361802	Adaptive pattern recognition based control system and method	 Thus, once an object is identified, an expected change in that object will not necessitate a REIDENTIFICATION of the object.	In a preferred embodiment, a model contained in a database includes a three or more dimensional representation of an object. These models include information processed by a fractal-based method to encode repetitive, transformed patterns in a plane, space, time, etc., as well as to include additional degrees of freedom, to compensate for changes in morphology of the object, to allow continuous object identification and tracking. Thus, once an object is identified, an expected change in that object will not necessitate a reidentification of the object. According to one embodiment, a fractal-like processing process is executed by optical elements of an optical or optical hybrid computer. Further, in order to temporarily store an optical image, optically active biological molecules, such as bacteriorhodopsins, etc. may be used. Liquid crystals or other electrophotorefractive active materials may also used. These imagers may be simple two dimensional images, holograms, or other optical storage methods. A preferred holographic storage method is a volume phase hologram, which will transform an impressed image, based on hologram to image correlation. Thus, these models would be somewhat linear transform independent, and would likely show some (planar) transform relationship. Thus, an optical computer may be advantageous because of its high computational speed as compared to digital computers for image analysis, due to inherent parallelism and high inherent speed.
	CN107944340A	A kind of combination is directly measured and the pedestrian of indirect measurement recognition methods again		
security				
	US9483689	Biometric matching technology	 The system 300 also determines whether the context of the situation is in a crime-sensitive area or jewelry store, whether the context of the situation is in an airport or railway station, whether the context of the situation is in a public transport location, a public park, or vehicular surveillance, or whether the context of the situation is in home SECURITY or school campus SECURITY.	The system 300 references the data structure 1500 in setting the batch size. For example, the system 300 determines the context and criticality of the situation based on user input, a pre-defined setting, and/or an alert feed (e.g., a threat level alert provided by a government organization or other organization). In this example, the system 300 determines whether the criticality of the situation is very high, high, medium, or low. The system 300 also determines whether the context of the situation is in a crime-sensitive area or jewelry store, whether the context of the situation is in an airport or railway station, whether the context of the situation is in a public transport location, a public park, or vehicular surveillance, or whether the context of the situation is in home security or school campus security. Based on the determinations, the system 300 references the data structure 1500 and sets the batch size as the number of images defined by the data structure 1500. For instance, the system 300 selects fifty images based on determining that the criticality is very high and the context is in a crime-sensitive area or jewelry store, selects twenty images based on determining that the criticality is high and the context is in an airport or railway station, selects ten images based on determining that the criticality is medium and the context is in a public transport location, a public park, or vehicular surveillance, and selects five images based on determining that the criticality is low and the context is in home security or school campus security.
	US10679044	Human action data set generation in a machine learning system	 Thus, this new data generation technique can improve the performance of current machine learning-based human action recognition computer vision systems, which may be used in, for example, SECURITY surveillance, sports analysis, smart home devices, and health monitoring.	The disclosed solution enables generation of human action video clips from a small set of original human action video clips without costly and time-consuming data acquisition. Moreover, by independently modeling action, subject, and context, the disclosed solution can generate any number of human action videos with varying backgrounds, human appearances, actions, and ways each action is performed. Further, through use of the generative model trained on a small labeled dataset of skeleton trajectories of human actions as described above with the first aspect, the system described herein may allow the use of unlimited unlabeled human action videos in training. Thus, this new data generation technique can improve the performance of current machine learning-based human action recognition computer vision systems, which may be used in, for example, security surveillance, sports analysis, smart home devices, and health monitoring.
	US10540749	System and method for learning-based image super-resolution	 For example, the application device can perform SECURITY applications.	Additionally, or alternatively, the output interface includes an application interface adapted to connect the image processing system 300 to an application device that can operate based on results of image upsampling and super-resolution. For example, the application device can perform security applications. For example, the application device can be operatively connected to the image generator trained by the image processing system 300 and being configured to upsample an input image using the image generator and perform a control action based on the upsampled input image.
	WO2019212749A1	Stabilizing video to reduce camera and face movement		
	US9292969	Dimensioning system calibration systems and methods	 Such functionality may include system SECURITY settings, system configuration settings, language preferences, dimension and volume preferences, and the like.	The processor(s) 220 can execute one or more instruction sets that are stored in whole or in part in the non-transitory, machine-readable storage media 218. The machine executable instruction set(s) can include instructions related to basic functional aspects of the one or more processors 220, for example data transmission and storage protocols, communication protocols, input/output (“I/O”) protocols, USB protocols, and the like. Machine executable instruction sets related to all or a portion of the calibration and dimensioning functionality of the dimensioning system 110 and intended for execution by the processor(s) 220 while in calibration or pre-run time mode, in run time mode, or combinations thereof may also be stored within the one or more non-transitory, machine-readable storage media 218, of the processor(s) 220, or within both the non-transitory, machine-readable storage media 218 and the processor(s) 220. Additional dimensioning system 110 functionality may also be stored in the form of machine executable instruction set(s) in the non-transitory, machine-readable storage media 218. Such functionality may include system security settings, system configuration settings, language preferences, dimension and volume preferences, and the like.
sex				
	CN106999111A	System and method for detecting invisible human emotion		
	WO2018134829A1	Method for sex sorting of mosquitoes and apparatus therefor		
	CN107704800A	Face identification method, system and its application system		
	CN103164858A	Adhered crowd segmenting and tracking methods based on superpixel and graph model	S13, build a weighted graph model according to human body prior shape information and colouring information on the super pixel segmentation figure of prospect, find optimal segmentation border between the adhesion target by the method for seeking optimal path, concrete steps are: S131, build a body shape model, and human body target is carried out template matches; S132, the limit on pixel segmentation figure super according to prospect and the shape difference of the object module opposite SEX build the shape weight on border; S133, the color distortion on pixel segmentation figure super according to prospect between every limit adjacent area block of pixels builds the color weight on border; S134 determines that one cuts apart starting point and end point, finds the path of Least-cost on weighted graph, is the optimal segmentation border of adhesion human body.	S13, build a weighted graph model according to human body prior shape information and colouring information on the super pixel segmentation figure of prospect, find optimal segmentation border between the adhesion target by the method for seeking optimal path, concrete steps are: S131, build a body shape model, and human body target is carried out template matches; S132, the limit on pixel segmentation figure super according to prospect and the shape difference of the object module opposite sex build the shape weight on border; S133, the color distortion on pixel segmentation figure super according to prospect between every limit adjacent area block of pixels builds the color weight on border; S134 determines that one cuts apart starting point and end point, finds the path of Least-cost on weighted graph, is the optimal segmentation border of adhesion human body.
	US10665326	Deep proteome markers of human biological aging and methods of determining a biological aging clock	 Many studies analyzing transcriptomes or proteomes of biopsies in a variety of diseases indicated that age and SEX of the patient have significant effects on gene expression and subsequent protein production and that there are noticeable changes in gene expression with age in mice, resulting in development of mouse aging gene expression databases and in humans.	Many biomarkers of aging have been proposed including telomere length, intracellular and extracellular aggregates, racemization of the amino acids and genetic instability. Gene expression and DNA methylation profiles change during aging, which also may be used as biomarkers of aging. As a result, protein production profiles that are translated from the genetically expressed mRNA may correspondingly be used as biomarkers of aging. Many studies analyzing transcriptomes or proteomes of biopsies in a variety of diseases indicated that age and sex of the patient have significant effects on gene expression and subsequent protein production and that there are noticeable changes in gene expression with age in mice, resulting in development of mouse aging gene expression databases and in humans.
sexuality				
	EP2960828A1	Face authentication device and face authentication method		
social network				
	US10586372	Online modeling for real-time facial animation	 Compared to communication via recorded video streams that only offer limited ability to alter the appearance of users, facial animation opens the door to fascinating new applications in computer gaming, SOCIAL NETWORKs, television, training, customer support, or other forms of online interactions.	Recent advances in real-time performance capture have brought within reach a new form of human communication. Capturing dynamic facial expressions of users and re-targeting these facial expressions on digital characters enables a communication using virtual avatars with live feedback. Compared to communication via recorded video streams that only offer limited ability to alter the appearance of users, facial animation opens the door to fascinating new applications in computer gaming, social networks, television, training, customer support, or other forms of online interactions. However, a successful deployment of facial animation technology at a large scale puts high demands on performance and usability.
	US8923570	Automated memory book creation	 Facial recognition may include the use of a database of known individuals, such a collection of images from a SOCIAL NETWORK, or a locally compiled database of images where individuals are pre-identified.	At 312, an image score may be determined or adjusted based on the identity of one or more individuals in an image through the use of facial recognition processes to determine the identity of individuals in the image. Facial recognition may include the use of a database of known individuals, such a collection of images from a social network, or a locally compiled database of images where individuals are pre-identified. An image score may be calculated or adjusted based on the frequency with which an individual appears in a set of images that are being analyzed, or the frequency in which images of the individual appears in a user's social network or local collection of images.
	US9357123	Image defocus blur estimation	, Snapfish®, Shutterfly®, and the like), photo storage and/or sharing services Flickr®), SOCIAL NETWORK services (e.	The environment 100 further depicts one or more service providers 112, configured to communicate with computing device 102 over a network 114, such as the Internet, to provide a “cloud-based” computing environment. Generally speaking, service providers 112 are configured to make various resources 116 available over the network 114 to clients. In some scenarios, users may sign up for accounts that are employed to access corresponding resources from a provider. The provider may authenticate credentials of a user (e.g., username and password) before granting access to an account and corresponding resources 116. Other resources 116 may be made freely available, (e.g., without authentication or account-based access). The resources 116 can include any suitable combination of services and/or content typically made available over a network by one or more providers. Some examples of services include, but are not limited to, photo editing services, image illustrating services, photo printing services (e.g., Snapfish®, Shutterfly®, and the like), photo storage and/or sharing services Flickr®), social network services (e.g., Facebook®, Twitter®, Instagram®, Hyperlapse®, and the like), and so forth.
	WO2019212749A1	Stabilizing video to reduce camera and face movement		
	US10129464	User interface for creating composite images	” The user interface may provide one or more user interface elements (fields) corresponding to one or more target destinations, such as an electronic storage, a server of a SOCIAL NETWORK site (e.	 FIG. 5C illustrate an exemplary interface for sharing composite images. The composite image displayed in the user interface may correspond to the composite image selected by the user (e.g., via the slider element shown in FIGS. 5A, 5B). The user interface may provide context for the sharing operation via text “SHARE THIS PHOTO.” The user interface may provide one or more user interface elements (fields) corresponding to one or more target destinations, such as an electronic storage, a server of a social network site (e.g., Facebook, Twitter, Instagram, etc.), a data server (e.g., Vimeo, Dropbox), and/or other destinations. Responsive to a user's selection of sharing the selected composite image(s), the selected composite image(s) may be communicated to one or more target destination via wired and/or wireless communications interface.
street				
	US9363489	Video analytics configuration	 Additionally, cameras may cover crowded areas and may include objects which are occluded by other objects, for example static occlusions where an urban feature occludes a portion of a STREET thereby occluding pedestrians and vehicles passing behind the urban feature or where pedestrians are occluded by each other such as in crowded environments.	Additionally, many video surveillance networks cover a wide geographic area and may have non-overlapping or non-contiguous view field coverage. Additionally, cameras may cover crowded areas and may include objects which are occluded by other objects, for example static occlusions where an urban feature occludes a portion of a street thereby occluding pedestrians and vehicles passing behind the urban feature or where pedestrians are occluded by each other such as in crowded environments.
	US9729787	Camera calibration and automatic adjustment of images	A large portion of consumer photos contain man-made structures, such as urban scenes with buildings and STREETs, and indoor scenes with walls and furniture.	A large portion of consumer photos contain man-made structures, such as urban scenes with buildings and streets, and indoor scenes with walls and furniture. However, photographing these structures properly is not an easy task. Photos taken by amateur photographers often contain slanted buildings, walls, and horizon lines due to improper camera rotations, as shown in the left column of FIG. 1.
