keyword	patent	title	sentence	section
	US10413226	Noncontact monitoring of blood oxygen saturation using camera	 The subjects included different GENDERs (three males, three females), ages (27.	Referring now to FIG. 11, an example of correlation between the lowest SpO2 values obtained from the presented noncontact and reference contact methods. Line 110 is a linear fit of the data points. To demonstrate the robustness of the disclosed noncontact method to monitor SpO2, a small-scale pilot study was conducted and statistical analysis of the data was completed. Six subjects were enrolled in the Institutional Review Board study approved by Arizona State University (No. STUDY00002240). The subjects included different genders (three males, three females), ages (27.3±2.8 years old, mean±SD), and skin colors. Informed consents were obtained from all the subjects following an approved protocol. None of the subjects had any known respiratory disease. The test was repeated as described above on different subjects and the lowest SpO2 values were compared as determined by using the presented method and reference pulse oximetry. Plot 111 is a plot of the lowest SpO2 values from 43 tests and linear least square regression. A good linear correlation (R2=0.87) was found between the presented and reference methods over a wide range of oxygen saturation levels. Slope of the linear fitting curve is about 0.86, which is small than the ideal value of 1, with standard error of 0.05. The data are dispersed around the fitted linear curve 110, which may be attributed to subject movement, and light scattering effects.
	US9189886	Method and apparatus for estimating body shape	 Additionally, it allows several novel methods to extract standard tailoring measurements, clothing sizes, GENDER and other information from body scans.	By construction, in the presently disclosed method every body model recovered from measurements is in full correspondence with every other body model. This means that a mesh vertex on the right shoulder in one person corresponds to the same vertex on another person's shoulder. This is unlike traditional laser or structured light scans where the mesh topology for every person is different. This formulation allows body shapes to be matched to each other to determine how similar they are; the method makes use of this in several ways. Additionally, it allows several novel methods to extract standard tailoring measurements, clothing sizes, gender and other information from body scans. Unlike traditional methods for measuring body meshes, the presently disclosed methods use a database of body shapes with known attributes (such as height, waist size, preferred clothing sizes, etc) to learn a mapping from body shape to attributes. The presently disclosed method describes both parametric and non-parametric methods for estimating attributes from body shape.
	WO2014098308A1	Method for displaying unified app information based on open app store, and computer readable recording medium therefor		
	US9986211	Low-power always-on face detection, tracking, recognition and/or analysis using events-based vision sensor	 There are many methods and applications available for detection, tracking, recognition of face(s) in still images and videos, including emotion detection, GENDER classification, lip reading, eye/gaze tracking, etc.	Human-computer interaction uses many modalities including language (typing, voice recognition, on-screen text display, speech synthesis, and the like) and vision (still and video cameras, graphic displays, and the like). Face detection, recognition, expressions, and so forth forms an important part of human-to-human communication and thereby is important for human-machine interaction as well. There are many methods and applications available for detection, tracking, recognition of face(s) in still images and videos, including emotion detection, gender classification, lip reading, eye/gaze tracking, etc.
geolocation				
	WO2020043350A1	Method(s) and system(s) for vehicular cargo management	 For example, when delivery personnel get to a customer stop, the system (104) identifies the customer at which they’ve arrived based on the GEOLOCATION of the vehicle.	[0048] In one aspect, the vehicle cargo management techniques of this disclosure may be used to direct couriers to the proper package at the time of delivery/unloading. For example, when delivery personnel get to a customer stop, the system (104) identifies the customer at which they’ve arrived based on the geolocation of the vehicle. The system (104) may then cross-reference the location with geofences drawn in a predefined radius around each customer delivery location. Alternatively, delivery personnel can select a particular customer from their delivery manifest via their handheld device (108), an in-vehicle console (108), or other application display (108). When a door to the cargo space is opened, the system (104) may identify the package IDs corresponding to the particular customer and look up the last known location of that package in the cargo space. 
	US10677932	Systems, methods, and devices for geo-localization	 A GEOLOCATION of the trajectory determination device can be determined.	In one embodiment a trajectory determination device for geo-localization can include one or more relative position sensors, one or more processors, and memory. The one or more relative position sensors can generate relative position signals. The one or more processors can be communicatively coupled to the one or more relative position sensors and the memory. The memory can store machine readable instructions. The one or more processors can execute the machine readable instructions to receive the relative position signals from the one or more relative position sensors. The relative position signals can be transformed into a sequence of relative trajectories. Each of the relative trajectories can include a distance and directional information indicative of a change in orientation of the trajectory determination device. A progressive topology can be created based upon the sequence of relative trajectories; this progressive topology can be compared to map data. A geolocation of the trajectory determination device can be determined.
	US10812861	Systems and methods for providing access to still images derived from a video	, a title, GEOLOCATION information associated with the content of the edited video, and/or other information associated with the edited video), editing-user information (e.	In some implementations, effectuating communication of one or more notifications may comprise communicating notifications to the one or more identified users via one or more of the one or more online platforms, an external communication (e.g., a text message and/or other communications), and/or other types of distribution. An some implementations, a notification may include notification information. Notification information may include one or more of a location to consume the edited video (e.g., a link), edited video information (e.g., a title, geolocation information associated with the content of the edited video, and/or other information associated with the edited video), editing-user information (e.g., a name, username, and/or other information associated with a user who generated the edited video), user interaction information (e.g., information identifying the type of user interaction previously engaged in by the user who is receiving the notification), and/or other information. In some implementations, a location to consume the edited video may include one or more of a location within a social media outlet, a location external to the social media outlet, a privately accessible location, a publically accessible location, and/or other locations.
	US9947128	Methods for improving accuracy, analyzing change detection, and performing data compression for multiple images	The absolute GEOLOCATION, georeference accuracy of GeoEye-1 was measured, improved, and reported by GeoEye's Kohm and Mulawa in 2009, 2010, and 2011.	The absolute geolocation, georeference accuracy of GeoEye-1 was measured, improved, and reported by GeoEye's Kohm and Mulawa in 2009, 2010, and 2011. The GeoEye-1 accuracies were validated by Fraser from the University of Melbourne in 2011. Mulawa showed that GeoEye-1 intra-image geometric accuracy, e.g., within an image, is +/−1 meter across the 15 kilometer swath. This accuracy was achieved through geometric calibration while on-orbit using repeated measurements at multiple sites in the United States and worldwide. The key finding was that for 64 or so images, the error of the means were ˜1 meter in the vertical and horizontal.
	US10371518	Surveying system	In some applications interactive GEOLOCATION without GNSS signal may be required.	In some applications interactive geolocation without GNSS signal may be required. The following method then can be used:
hand				
	US9148463	Methods and systems for improving error resilience in video delivery	 The human portion may be further refined into finer objects such as body, arm, HAND, finger, head, nose, eye, mouth, etc.	In more detail, according to at least one example embodiment a most recent available image frame for a video scene including a person (e.g., on a one-to-one video call) is analyzed and separated into its semantic components. At its simplest, the image frame may be divided into a “human” (or more generally an “object” portion) and a “background” portion. The background may be assumed to be essentially static, and depending on the application, may not need to be further broken down. The human portion may be further refined into finer objects such as body, arm, hand, finger, head, nose, eye, mouth, etc.
	CN102819662B	Computing method of video fluid height	At present, in augmented reality research, the research combined for rigid body actual situation has achieved preliminary achievement, and for the scene containing fluids such as water, smog, cloud, fire, because fluid belongs to strong texture, in motion process, there is the problem blocked and reproduce, so the research of the augmented reality of associated fluid also exists certain challenge, the achievement obtained in this on the one HAND research is remarkable not enough.	At present, in augmented reality research, the research combined for rigid body actual situation has achieved preliminary achievement, and for the scene containing fluids such as water, smog, cloud, fire, because fluid belongs to strong texture, in motion process, there is the problem blocked and reproduce, so the research of the augmented reality of associated fluid also exists certain challenge, the achievement obtained in this on the one hand research is remarkable not enough.Fluid reconstruction technique is the key issue in research, how quickly and accurately Fluid Computation height, set up augmented reality scene that is realistic and the fluid natural landscape of interactivity, be still in this field and have challenging problem, its research has important practical significance and using value.
	US9870068	Depth mapping with a head mounted display using stereo cameras and structured light	 FIG. 5A shows a HAND being tracked by a light pattern comprising a plurality of horizontal bars orientated parallel to the HAND, in accordance with an embodiment.	 FIG. 5A shows a hand being tracked by a light pattern comprising a plurality of horizontal bars orientated parallel to the hand, in accordance with an embodiment.
	US9020210	Image processing system, image processing apparatus, image processing method, and program	On the other HAND, computer-graphics generated animated images are built on the basis of scenario information describing camera works, character movements, and the like.	On the other hand, computer-graphics generated animated images are built on the basis of scenario information describing camera works, character movements, and the like. Therefore, by using the scenario information, effects can be semi-automatically applied to computer-graphics generated animated images (see, for example, Japanese Patent No. 4245433). However, since so-called actual-captured images actually captured with an image capturing apparatus are not images based on such scenario information, it is difficult to apply effects to such actual-captured images semi-automatically.
	EP3432204A1	Telepresence framework for region of interest marking using headmount devices		
iris				
	US9483689	Biometric matching technology	, images of IRISes, fingerprints, faces, etc.	 FIG. 3 illustrates an exemplary biometric matching system 300. The system 300 includes an input module 310, a data store 320, one or more processors 330, one or more I/O (Input/Output) devices 340, and memory 350. The input module 320 may be used to input any type of information used in enrolling and verifying biometric data. For example, the input module 310 may be used to receive new biometric data to enroll in a database or receive sample biometric data to verify against biometric data stored in a database. In some implementations, data from the input module 310 is stored in the data store 320. The data included in the data store 320 may include, for example, any type of biometric data (e.g., images of irises, fingerprints, faces, etc.) and similarity scores computed for biometric data. The similarity scores may be used to sort biometric data in the data store 320 using techniques described throughout this disclosure.
	US10372982	Methods and apparatus for repetitive iris recognition	: PCT/US2015/010293, filed Jan. 6, 2015, titled “METHODS AND APPARATUS FOR REPETITIVE IRIS RECOGNITION” which in turn claims priority to U.	This application is a national stage of, and claims priority to and the benefit of the Patent Application No.: PCT/US2015/010293, filed Jan. 6, 2015, titled “METHODS AND APPARATUS FOR REPETITIVE IRIS RECOGNITION” which in turn claims priority to U.S. provisional application 61/924,055, filed Jan. 6, 2014, titled “METHODS AND APPARATUS FOR REPETITIVE IRIS RECOGNITION”; U.S. provisional application 62/056,598, filed Sep. 28, 2014, titled “METHODS AND APPARATUS FOR REPETITIVE IRIS RECOGNITION” and U.S. provisional application No. 62/056,600, filed Sep. 28, 2014, titled “METHODS AND APPARATUS FOR ILLUMINATING THE IRIS FOR IRIS RECOGNITION,” all of which are hereby incorporated by reference in their entireties for all purposes.
	US10479647	Depth sensor based sensing for special passenger conveyance loading conditions	 That is, the sensor data from the security sensors 280 essentially provides data to the control system 32 to include, but not be limited to, facial recognition, badge identification, fingerprints IRIS data, security card information, etc.	Referring now to FIG. 25, the fusion based passenger tracking system 270 may include a plurality of security sensors 280 a-280 n that communicate with the elevator system 20 via the control system 32. That is, the sensor data from the security sensors 280 essentially provides data to the control system 32 to include, but not be limited to, facial recognition, badge identification, fingerprints iris data, security card information, etc. In areas without surveillance coverage or where the analytics processes may not perform well, the additional security sensors can recognize the person and then, using sensor fusion, close the gaps in the traffic list to make the whole process more robust. In any instance where identity is associated with a passenger, the identity and associated passenger tracking data is maintained in a way that preserves privacy by using encryption, authentication, and other security measures.
	US9596983	Methods and systems for tracking a torsional orientation and position of an eye	In one embodiment, a method comprises selecting at least one marker on the IRIS of the eye in the first image.	In one embodiment, a method comprises selecting at least one marker on the iris of the eye in the first image. A corresponding marker is located on the iris in the second image. The first image of the eye and the second image of the eye are registered by substantially matching a common reference point in the first and second images and matching the marker on the iris of the image of the first eye and the marker on the iris of the image of the second eye. Thereafter, a laser treatment can be centered and torsionally aligned with the second image of the eye. In some embodiments, the second image of the eye can be obtained while the patient's eye is aligned with a laser beam that is to deliver the laser treatment.
	US10159411	Detecting irregular physiological responses during exposure to sensitive data	, an IRIS scan), and/or multi-factor authentication.	Some embodiments of the system configured to detect an irregular physiological response while being exposed to sensitive data include added security measures such as encryption of the sensitive data. Optionally, the system receives the certain sensitive data in an encrypted form, and the computer decrypts the certain sensitive data before presentation via the HMD. The decryption may involve hardware-based decryption, requesting a password from the user, and/or measuring the user with a sensor (e.g., an iris scan), and/or multi-factor authentication.
irises				
	US9280706	Efficient method and system for the acquisition of scene imagery and iris imagery using a single sensor	 Feedback mechanisms can guide the user to move the image capturing device to locate the user's IRISES within an appropriate capture region.	Another approach incorporated in some embodiments of our methods and systems for acquiring optimal standard scene imagery and iris imagery on the same sensor, relating to the wavelength of the illumination, involves multiplexing or positioning an infra-red cut filter over a standard image sensor or lens. In one embodiment, a portion of the sensor (for example, 20% of the sensor or sensor nodes) may be designated primarily for iris recognition, while the remaining (e.g., 80%) portion may be used for standard image acquisition, for example as shown in FIG. 14. A lower portion (e.g., 80%) of the sensor, as in this example, may be covered by a standard IR-cut filter. The remaining 20% of the sensor may remain uncovered. In iris recognition mode, the covered region may be ignored. For example, an iris recognition application executing on the image capturing device may guide the user to position their eyes within the sensing region of the uncovered 20% area. Feedback mechanisms can guide the user to move the image capturing device to locate the user's irises within an appropriate capture region. For example, since the face will be visible in the remaining 80% of the imager, this can be used for user guidance feedback, optionally with icons appearing in place of the eye region. In some embodiments, the image sensor may adjust its orientation to capture an image of the user's iris using the uncovered region.
	US9852338	Biometric imaging method and device	 Taking iris as an example, the micromotor controller 130 can perform simultaneous imaging of the regions of human eyes, and for each frame of the acquired image calculate in real time the central positions of pupils of human left and right eyes using an image processing algorithm to thereby realize real-time lookup and real-time location of IRISES of both eyes in the entire imaging image and cut out said imaging image into a monocular iris image of the left eye or right eye.	For example, the micromotor controller 130 can rapidly locate a biometric region of interest, such as iris region of human eyes with respect to any frame of electronic image as acquired by the image sensor 120. Taking iris as an example, the micromotor controller 130 can perform simultaneous imaging of the regions of human eyes, and for each frame of the acquired image calculate in real time the central positions of pupils of human left and right eyes using an image processing algorithm to thereby realize real-time lookup and real-time location of irises of both eyes in the entire imaging image and cut out said imaging image into a monocular iris image of the left eye or right eye. As shown in FIG. 6, the image resolution is generally 640×480. The monocular iris image of the left eye or right eye obtained by image segmentation can be used as an analysis object for assessment of the definition of the image acquired by the biometric imaging device 100. Then, with respect to any monocular iris or irises of eyes, image analysis is performed on an image quality function (ImageQualityMetrics) thereof. The calculation of said function can be realized by means of a plurality of energy transfer functions F, including but not limited to Discrete Cosine Transform (DCT), Fast Fourier Transform (FFT) or Wavelet Transform (Wavelet), etc. The image quality information obtained by calculation may be an array of image quality parameters, and may also be a single image quality parameter including but not limited to definition, contrast, average gray scale, image information entropy, interpupillary distance, pupil diameter, iris diameter, etc. of the image.
	US9841563	Shuttered waveguide light field display	 Detection is also easily extended to other useful features of the face and eyes, including the eyebrows, nose, mouth, eyelids, scleras, IRISES and pupils [Betke00, Lienhart03, Hansen10].	Approximate eye detection is typically intrinsic to face detection, and more accurate eye positions can be estimated after face detection [Hansen10]. Detection is also easily extended to other useful features of the face and eyes, including the eyebrows, nose, mouth, eyelids, scleras, irises and pupils [Betke00, Lienhart03, Hansen10].
	US9313460	Depth-aware blur kernel estimation method for iris deblurring	The present invention relates to apparatuses and methods for identifying personnel and, more particularly, to apparatuses and methods for identifying personnel based on visual characteristics of the IRISES of their eyes.	The present invention relates to apparatuses and methods for identifying personnel and, more particularly, to apparatuses and methods for identifying personnel based on visual characteristics of the irises of their eyes.
	US10733924	Foveated light field display	 Detection is also easily extended to other useful features of the face and eyes, including the eyebrows, nose, mouth, eyelids, scleras, IRISES and pupils [Betke00, Lienhart03, Hansen10].	Approximate eye detection is typically intrinsic to face detection, and more accurate eye positions can be estimated after face detection [Hansen10]. Detection is also easily extended to other useful features of the face and eyes, including the eyebrows, nose, mouth, eyelids, scleras, irises and pupils [Betke00, Lienhart03, Hansen10].
jail				
	US10296784	Verifying presence of a person during an electronic visitation	, municipal JAILs, county JAILs, state prisons, federal prisons, military stockades, juvenile facilities, detention camps, home incarceration environments, etc.	This specification discloses methods and systems for verifying the presence of one or more actual and/or authorized persons during an electronic visitation. The various techniques described herein may find applicability in a wide variety of controlled-environment facilities (as well as outside of controlled-environment facilities). Various types of controlled-environment facilities are present in today's society, and persons may be voluntary or involuntary residents of such facilities, whether temporarily or permanently. Examples of controlled-environment facilities may include correctional institutions or facilities (e.g., municipal jails, county jails, state prisons, federal prisons, military stockades, juvenile facilities, detention camps, home incarceration environments, etc.), healthcare facilities (e.g., hospitals, nursing homes, mental health facilities, rehabilitation clinics, such as drug and alcohol rehabilitation facilities, etc.), restricted living quarters (e.g., hotels, resorts, camps, dormitories, barracks, etc.), and the like.
kid				
	US9665702	Restricted execution modes	 61/695,294 filed Aug. 30, 2012 entitled “Mobile Device Kid Space”, the disclosure of which is incorporated by reference herein in its entirety.	This application is a continuation of U.S. patent application Ser. No. 13/726,099 filed Dec. 22, 2012 entitled “Restricted Execution Modes,” which claims priority under 35 U.S.C. Section 119(e) to U.S. Provisional Application Ser. No. 61/580,147 filed Dec. 23, 2011 entitled “Mobile Device Shared”, the disclosures of which are incorporated by reference herein in its entirety. This application also claims priority under 35 U.S.C. Section 119(e) to U.S. Provisional Application Ser. No. 61/695,294 filed Aug. 30, 2012 entitled “Mobile Device Kid Space”, the disclosure of which is incorporated by reference herein in its entirety.
	US9426451	Cooperative photography	Imagine you are a parent attending the pre-prom obligatory photo-fest with your KID, their date, and eight other teen-couples to boot.	Imagine you are a parent attending the pre-prom obligatory photo-fest with your kid, their date, and eight other teen-couples to boot. Lots of parents—all with smartphones held proudly forth on the now-milling, now-posing couples, sometimes alone, then ad hoc pairings and then of course the 30 minutes of the big group shots. The prairie dog cameras shooting up and down and all around in the process, also culminating in a large group of parents lined opposite the smaller group of kids, most cameras now in action.
