keyword	patent	title	sentence	section
	US10349887	Blood pressure measuring smartglasses	Elevated blood pressure is a significant cause of death and DISABILITY in the world.	Elevated blood pressure is a significant cause of death and disability in the world. Attaining accurate blood pressure measurements is vital in the prevention and treatment of various blood-pressure-related diseases. However, continuous monitoring with existing blood pressure monitors (e.g., cuff-based devices) can be difficult, uncomfortable, and impractical to perform in real-world settings (e.g., at work, while commuting, etc.). Thus, there is a need to a way to continuously monitor blood pressure in a comfortable way.
	US9685174	Mood monitoring of bipolar disorder using speech analysis	 Bipolar disorder is among the leading causes of DISABILITY worldwide.	Bipolar disorder (BP) is a common and severe psychiatric illness characterized by pathological swings of mania and depression and is associated with devastating personal, social, and vocational consequences (suicide occurs in up to 20% of cases, by some reports). Bipolar disorder is among the leading causes of disability worldwide. The cost in the United States alone was estimated at $45 billion annually (in 1991 dollars). These economic and human costs, along with the rapidly increasing price of health care provide the impetus for a major paradigm shift in health care service delivery, namely to monitor and prioritize care with a focus on prevention.
	US10776423	Motor task analysis system and method	0, indicative of a neurostatus score, a DISABILITY status scale, and/or an expanded DISABILITY status scale.	The method 1000 may also include calculating a disease severity score based on at least one of the motion descriptors. The disease severity may be assessed based at least in part on the disease severity score. In one embodiment, the disease severity score may have a value in a range from about 0.0 to about 12.0, indicative of a neurostatus score, a disability status scale, and/or an expanded disability status scale. In some embodiments, a disease severity score may be scaled to have any desired range of values, such as between 0 and 100, 0 and 10, 1 and 10, etc.
enemy				
	US9841602	Location indicating avatar in head worn computing	 Similarly, ENEMY fire traces 2104 may be color coded or otherwise distinguished on the displayed digital content.	In embodiments, certain user positions may be known and thus identified in the FOV. For example, the shooter of the friendly fire trace 2108 may be from a known friendly combatant and as such his location may be known. The position may be known based on his GPS location based on a mobile communication system on him, such as another HWC 102. In other embodiments, the friendly combatant may be marked by another friendly. For example, if the friendly position in the environment is known through visual contact or communicated information, a wearer of the HWC 102 may use a gesture or external user interface 104 to mark the location. If a friendly combatant location is known the originating position of the friendly fire trace 2108 may be color coded or otherwise distinguished from unidentified traces on the displayed digital content. Similarly, enemy fire traces 2104 may be color coded or otherwise distinguished on the displayed digital content. In embodiments, there may be an additional distinguished appearance on the displayed digital content for unknown traces.
	US10699719	System and method for taxonomically distinguishing unconstrained signal data segments	 For example, certain combinations of features may signify suitable landing zones in a particular region of engagement, or certain mountain terrain features such as draws may signify key areas of ENEMY activity.	In addition to matching established terrain classes, the subject system and method may be suitably applied by end-users to identify their own signature classes of interest. For example, certain combinations of features may signify suitable landing zones in a particular region of engagement, or certain mountain terrain features such as draws may signify key areas of enemy activity. Training examples may be highlighted by the user, such that similar structures may be then automatically identified in a local area. In another application, certain salient ground features may be identified for use as referential waypoints or landmarks in small dismounted ground unit navigation.
	US10698223	See-through computer display systems	 Similarly, ENEMY fire traces 2104 may be color coded or otherwise distinguished on the displayed digital content.	In embodiments, certain user positions may be known and thus identified in the FOV. For example, the shooter of the friendly fire trace 2108 may be from a known friendly combatant and as such his location may be known. The position may be known based on his GPS location based on a mobile communication system on him, such as another HWC 102. In other embodiments, the friendly combatant may be marked by another friendly. For example, if the friendly position in the environment is known through visual contact or communicated information, a wearer of the HWC 102 may use a gesture or external user interface 104 to mark the location. If a friendly combatant location is known the originating position of the friendly fire trace 2108 may be color coded or otherwise distinguished from unidentified traces on the displayed digital content. Similarly, enemy fire traces 2104 may be color coded or otherwise distinguished on the displayed digital content. In embodiments, there may be an additional distinguished appearance on the displayed digital content for unknown traces.
	US9958674	Eye imaging in head worn computing	 Similarly, ENEMY fire traces 2104 may be color coded or otherwise distinguished on the displayed digital content.	In embodiments, certain user positions may be known and thus identified in the FOV. For example, the shooter of the friendly fire trace 2108 may be from a known friendly combatant and as such his location may be known. The position may be known based on his GPS location based on a mobile communication system on him, such as another HWC 102. In other embodiments, the friendly combatant may be marked by another friendly. For example, if the friendly position in the environment is known through visual contact or communicated information, a wearer of the HWC 102 may use a gesture or external user interface 104 to mark the location. If a friendly combatant location is known the originating position of the friendly fire trace 2108 may be color coded or otherwise distinguished from unidentified traces on the displayed digital content. Similarly, enemy fire traces 2104 may be color coded or otherwise distinguished on the displayed digital content. In embodiments, there may be an additional distinguished appearance on the displayed digital content for unknown traces.
	US10269148	Real-time image undistortion for incremental 3D reconstruction	, military observation of a region to locate an ENEMY or ascertain strategic features), disaster relief, or other time-sensitive operations.	Embodiments generate a 3D reconstruction as a textured model, in real or near-real time as the imagery is obtained, and place that model in a 3D visualization of the earth from live imagery (e.g., still images or video) from a manned or unmanned vehicle. Accordingly, embodiments allow for fast decision making by providing rapid feedback for inspection (e.g., in commercial applications), reconnaissance (i.e., military observation of a region to locate an enemy or ascertain strategic features), disaster relief, or other time-sensitive operations.
ethnicity				
	US8884980	System and method for changing hair color in digital images	 At least one characteristic capable of affecting the result of the hair color product may be obtained, such as a hair texture, an ETHNICITY, a starting hair color, or any other characteristic capable of affecting the result of a hair color product on a subject.	A hair color product associated with the target hair color may be displayed, including a product image, product name, product brand, product color, or any other product information. The output image may represent a simulation of the hair color product on the subject. At least one characteristic capable of affecting the result of the hair color product may be obtained, such as a hair texture, an ethnicity, a starting hair color, or any other characteristic capable of affecting the result of a hair color product on a subject. At least one of the target color distribution and the color transformation may be modified based on the at least one characteristic. The at least one characteristic may be obtained by extracting one or more characteristics from the starting image.
	US10140521	Method, system and apparatus for processing an image	The appearance distance of the head segment in equation (5) is treated with a lower power than the appearance distance of the shoulder segment because the appearance of the head segment is less consistent (as it can appear as either face or hair depending on the direction of the head with respect to the camera) and less discriminative (as people of the same ETHNICITY often have similar skin colour).	The appearance distance of the head segment in equation (5) is treated with a lower power than the appearance distance of the shoulder segment because the appearance of the head segment is less consistent (as it can appear as either face or hair depending on the direction of the head with respect to the camera) and less discriminative (as people of the same ethnicity often have similar skin colour).
	US9483689	Biometric matching technology	 The image processor 230 also may determine the angle, gender, ETHNICITY, and any other detectable attributes of a person within the one or more images based on an analysis of the one or more images.	The image processor 230 processes the one or more images to determine attributes of the images and/or persons within the one or more images. For instance, the image processor 230 may compute the distance between a person within an image and the camera 210 based on an analysis of the captured image. The image processor 230 also may determine the angle, gender, ethnicity, and any other detectable attributes of a person within the one or more images based on an analysis of the one or more images. The image processor 230 also may determine general characteristics (e.g., blurriness, etc.) of the one or more images based on an analysis of the one or more images.
	US10546417	Method and apparatus for estimating body shape	 to infer ETHNICITY).	In many applications, the gender of a person being scanned may be known or the user may specify that information. In these cases, body shape using the appropriate gender-specific body model is estimated (Section 3) When gender is not known there are several options. One can fit a gender-neutral body model that is capable of representing male or female bodies. Second, one can fit using both male and female body shape models and select the one that achieves a lower error of the objective function. Third, one can fit a gender-neutral model and then classify gender directly from the estimated shape coefficients, as described in Section 10. Once gender is known, a refined shape estimate using the appropriate gender-specific shape model is produced. The same strategies can be used for other subpopulations (e.g. to infer ethnicity).
	WO2018175357A1	Methods for age appearance simulation	 The present application relates generally to methods for age appearance simulation and more specifically to utilizing ETHNICITY, age, and gender inputs to predict face shape, color, and/or texture for simulating an age of an individual using statistical models.	 The present application relates generally to methods for age appearance simulation and more specifically to utilizing ethnicity, age, and gender inputs to predict face shape, color, and/or texture for simulating an age of an individual using statistical models. 
face				
	US9020210	Image processing system, image processing apparatus, image processing method, and program	A technique exists which applies a manipulation to a FACE region recognized from an image by using a FACE recognition technique.	A technique exists which applies a manipulation to a face region recognized from an image by using a face recognition technique. In the case of manipulation using a face recognition technique, although only a face region is subject to manipulation in many cases, for example, a manipulation can be applied to the body portion through application of a rule that a body exists below a face region. However, depending on the pose of a human, such manipulation using a face recognition technique often results in a manipulated image that looks unnatural.
	CN106952301A	A kind of RGB D saliency computational methods		
	US10679044	Human action data set generation in a machine learning system	 Large data sets, such as thousands or millions of photos/videos of objects, animals, FACEs, or scenes, are required to enable complex neural networks to train successfully.	As described above, advanced machine learning techniques and training data require computational power and deep learning networks. Large data sets, such as thousands or millions of photos/videos of objects, animals, faces, or scenes, are required to enable complex neural networks to train successfully. However, in some cases, only small data sets are available, which does not provide enough data for a machine learning process. Common methods for generating additional data sets to be used for training data are limited by the number of subjects or environments available or by the similarity between an existing image/video and a desired image/video.
	US9262674	Orientation state estimation device and orientation state estimation method	For the method of recognizing an object of interest within the image, one may employ a technique involving: creating strong classifiers by combining the sums of a plurality of weak classifiers based on rectangular information through AdaBoost; combining the strong classifiers in a cascade; and recognizing a FACE as an object of interest within the image, for example.	For the method of recognizing an object of interest within the image, one may employ a technique involving: creating strong classifiers by combining the sums of a plurality of weak classifiers based on rectangular information through AdaBoost; combining the strong classifiers in a cascade; and recognizing a face as an object of interest within the image, for example. For the image features, scale-invariant feature transform (SIFT) features may be employed (e.g., see NPL 2), for example. SIFT features are configured with 128-dimensional vectors, and are values that are computed for each pixel. Because SIFT features are unaffected by scale changes, rotation, or translation of the object to be detected, they are particularly effective for detecting parts that are rotatable in various directions, e.g., the arms. In other words, SIFT features are suited for the present embodiment which defines posture states through the relative joint positions and angles of two or more parts of interest.
	US10540749	System and method for learning-based image super-resolution	 For example, FACE upsampling or a FACE super-resolution is the task of generating a high-resolution FACE image from a low-resolution input image of the FACE.	Super-resolution is a task aiming to produce a high-resolution image from a low-resolution image. For example, face upsampling or a face super-resolution is the task of generating a high-resolution face image from a low-resolution input image of the face. The face upsampling has widespread application in surveillance, authentication and photography. Face upsampling is particularly challenging when the input face resolution is very low (e.g., 12×12 pixels), the magnification rate is high (e.g. 8×), and/or the face image is captured in an uncontrolled setting with pose and illumination variations.
facial				
	US9148463	Methods and systems for improving error resilience in video delivery	 For example, the Microsoft® Kinect camera system generates detailed models of both a subject's face (detecting over 100 FACIAL landmarks) and body position (skeletal joints) in less than a frame time.	In recent years, there have been advances in computer analysis and modeling of the human body. For example, the Microsoft® Kinect camera system generates detailed models of both a subject's face (detecting over 100 facial landmarks) and body position (skeletal joints) in less than a frame time. Additionally, other systems are also available with varying degrees of analysis capability.
	US10586372	Online modeling for real-time facial animation	 No. 15/641,428, entitled “Online Modeling For Real-Time Facial Animation,” which further is a continuation of, and claims priority to, U.	This is a continuation of, and claims priority to, U.S. patent application Ser. No. 15/641,428, entitled “Online Modeling For Real-Time Facial Animation,” which further is a continuation of, and claims priority to, U.S. patent application Ser. No. 15/167,966, entitled “Online Modeling For Real-Time Facial Animation,” which further is a continuation of, and claims priority to, U.S. patent application Ser. No. 13/912,378, all of which are hereby incorporated by reference in their entirety.
	US9483689	Biometric matching technology	, fingerprints, retina scans, FACIAL images, etc.	A typical biometric matching system includes a database of biometric information (e.g., fingerprints, retina scans, facial images, etc.) about individuals. To identify or authenticate a sample of biometric information, the typical biometric matching system compares the sample with entries in the database one by one until a match is found. As a result, the time to find a matching entry grows linearly and may be time consuming when the database includes many entries.
	US7426292	Method for determining optimal viewpoints for 3D face modeling and face recognition	, “Realistic Modeling for Facial Animations,” Proceedings of SIGGRAPH 95, pages 55-62, August, 1995, or the availability of high quality of texture images as a substitute for exact face geometry, see Guenter et al.	In computer graphics, it is still a fundamental problem to synthetically construct realistic human heads, particularly the face portion. Hereinafter, when referring to ‘head’ or ‘face’, the invention is most interested in that portion of the head extending from chin-to-brow, and ear-to-ear. Most prior art methods require either extensive manual labor by skilled artists, expensive active 3D scanners, Lee et al., “Realistic Modeling for Facial Animations,” Proceedings of SIGGRAPH 95, pages 55-62, August, 1995, or the availability of high quality of texture images as a substitute for exact face geometry, see Guenter et al., “Making Faces,” Proceedings of SIGGRAPH 98, pages 55-66, July 1998, Lee et al., “Fast Head Modeling for Animation,” Image and Vision Computing, Vol. 18, No. 4, pages 355-364, March 2000, Tarini et al., “Texturing Faces,” Proceedings Graphics Interface 2002, pages 89-98, May 2002.
	US9076703	Method and apparatus to use array sensors to measure multiple types of data at full resolution of the sensor	, FACIAL recognition) in the images and finds task-relevant objects to modified or augmented (such as in augmented reality).	Computer vision has become a field that is integral to different imaging applications running on several devices that are used daily. Computer vision goes to the next step after imaging, which is using the information in the image to achieve different tasks defined by the user. For example, computer vision applications find faces (e.g., facial recognition) in the images and finds task-relevant objects to modified or augmented (such as in augmented reality). A prime example of these systems are the Human Natural User Interfaces (HNUI). These interfaces are used in many devices that are becoming more and more adopted by users.
facial recognition				
	US9483689	Biometric matching technology	In some implementations, a multi-dimensional approach that leverages FACIAL RECOGNITION technology is used to identify a suspect in a crowd in real time.	In some implementations, a multi-dimensional approach that leverages facial recognition technology is used to identify a suspect in a crowd in real time. The approach converts a sequential face matching process to a parallel process, leveraging flexible computing and storage resources in the cloud for parallel processing while constraining the number of resources to be used in the cloud to optimize expenses without sacrificing performance.
	WO2015132575A1	Apparatus and method for generating and using a subject-specific statistical motion model	 The images may also be two dimensional; this may be appropriate, for example, in a FACIAL RECOGNITION systems.	 The geometric representations may, for example, comprise images. The images may be three-dimensional, especially for representing the three-dimensional shape of the anatomical structure. The images may also be two dimensional; this may be appropriate, for example, in a facial recognition systems. The images may be obtained from one or more suitable imaging modalities, such as (without limitation) magnetic resonance imaging (MRI), X-ray computed tomography (CT), positron emission tomography (PET), ultrasound, photo-acoustic imaging (PAT), optical, X-ray or gamma ray imaging, optical microscopy, electron microscopy, etc. 
	US10534808	Architecture for responding to visual query	 The plurality of visual query search processes includes at least: optical character recognition (OCR), FACIAL RECOGNITION, and a first query-by-image process other than OCR and FACIAL RECOGNITION.	According to some embodiments, there is computer-implemented method of processing a visual query at a server system. A visual query is received from a client system. The visual query is processed by sending the visual query to a plurality of parallel search systems for simultaneous processing. Each of the plurality of search systems implements a distinct visual query search process of a plurality of visual query search processes. The plurality of visual query search processes includes at least: optical character recognition (OCR), facial recognition, and a first query-by-image process other than OCR and facial recognition. A plurality of search results is received from one or more of the plurality of parallel search systems. At least one of the plurality of search results is sent to the client system.
	US9141855	Accelerated object detection filter using a video motion estimation module	 For example, in FACIAL RECOGNITION applications, the reference vector may represent a random representative face or a face representing a statistical mean of faces, or the reference vector may be a zero-valued reference vector.	As described in greater detail below, such a calculation may be repurposed for object detection pre-filtering. For example, an individual region of an input image may be selected or determined. The above calculation may be repurposed to determine a computation that sums the dot product of a weighting vector and a vector of the absolute value difference of a vector representing the region and a reference vector. In this context, the reference vector may be chosen to enhance the classification of the region as likely including an object or portion of an object of interest (i.e., passing the linear classifier pre-filtering) or unlikely to include an object or portion of an object of interest (i.e., failing the linear classifier pre-filtering and being rejected). For example, in facial recognition applications, the reference vector may represent a random representative face or a face representing a statistical mean of faces, or the reference vector may be a zero-valued reference vector. Similarly, in this context, the weighting vector may be pre-trained to enhance object recognition pre-filtering. For example, in facial recognition applications, the weighting vector may be pre-trained by a number of images including faces and a number of images not including faces.
	US9734433	Estimating photometric properties using a camera and a display screen	 The map is then used by image processing routines to better identify and track foreground objects, such as FACIAL RECOGNITION and tracking routines, object recognition and tracking routines, area surveillance and motion detection routines, etc.	Having identified which regions contain specular surfaces and which regions contain diffuse surfaces, a map of the room is generated. The map may include scalable and/or non-scalable boundaries defining regions, and information for each region characterizing the region as diffuse, specular, or some degree there between, and providing surface normal for the regions. Boundaries of the specular regions may be refined by determining areas of the images that share similar local image characteristics such as color and edges. The values assigned to a region characterizing its specularity may, for example, be a value approximating its shininess based on the degree of interdependence between the variations in luminance from the region and the variations in illumination from the display 116. The map is then used by image processing routines to better identify and track foreground objects, such as facial recognition and tracking routines, object recognition and tracking routines, area surveillance and motion detection routines, etc.
female				
